{
  "company": "Northwind Analytics Inc",
  "historical": {
    "years": [2020, 2021, 2022, 2023, 2024],
    "revenue": [10.0, 11.0, 12.0, 13.2, 14.5],
    "ebitda": [2.0, 2.3, 2.6, 2.9, 3.2],
    "capex": [0.4, 0.45, 0.5, 0.52, 0.56],
    "nwc": [1.0, 1.1, 1.2, 1.3, 1.45]
  },
  "assumptions": {
    "projection_years": 5,
    "revenue_growth": [0.08, 0.07, 0.06, 0.05, 0.04],
    "tax_rate": 0.25,
    "terminal_growth": 0.025
  },
  "wacc": {
    "risk_free_rate": 0.04,
    "beta": 1.15,
    "market_premium": 0.05,
    "cost_of_debt": 0.055,
    "debt_to_equity": 0.45,
    "tax_rate": 0.25
  },
  "equity": {
    "net_debt": 4.0,
    "cash": 7.2,
    "shares_outstanding": 5.0
  }
}
